{
  "version": "1.0",
  "description": "Risk bands and Auth Assurance Levels (AL1–AL4). Data stores supply raw scores; policy defines bands and required AL per action tier.",
  "riskLevelBands": {
    "HIGH": {
      "fraudScoreMin": 80
    },
    "MEDIUM": {
      "fraudScoreMin": 26,
      "fraudScoreMax": 79
    },
    "LOW": {
      "fraudScoreMax": 25
    }
  },
  "riskLevelOrder": [
    "HIGH",
    "MEDIUM",
    "LOW"
  ],
  "defaultRiskLevel": "MEDIUM",
  "actionTierRequirements": {
    "Tier1": 30,
    "Tier2": 55,
    "Tier3": 70,
    "Tier4": 90
  },
  "actionTierRequiredAL": {
    "Tier1": "AL1",
    "Tier2": "AL2",
    "Tier3": "AL3",
    "Tier4": "AL4"
  },
  "effectiveConfidence": {
    "deviceWeight": 40,
    "fraudWeight": 60,
    "useAuthenticatorMax": true,
    "_note": "deviceWeight + fraudWeight must sum to 100. Formula: (deviceScore/100 * deviceWeight) + ((100-fraudScore)/100 * fraudWeight)"
  }
}
